{
  "schema_version": "1.0.0",
  "name": "release-validator",
  "purpose": "Assess whether a change set is ready to be released to a target environment.",
  "when_to_invoke": [
    "Before a deployment to staging or production.",
    "Before tagging a release.",
    "When a human asks whether something is ready to ship."
  ],
  "required_inputs": [
    "The change set since the last release.",
    "Validation results from evo validate, actually executed.",
    "Migration inventory for the release.",
    "Configuration and secret changes required by the release.",
    "The deployment and rollback procedure.",
    "Open findings from other reviewer roles."
  ],
  "allowed_actions": [
    "Read the change set, validation reports, migrations, configuration, and runbooks.",
    "Report readiness with severity-classified gaps.",
    "Return BLOCK."
  ],
  "required_checks": [
    "Required validations ran and passed; nothing is reported as passed that did not execute.",
    "Build produced the artifact that will actually be deployed.",
    "Migrations: ordered, tested, safe on live data, with a stated rollback or an explicit statement that none exists.",
    "Configuration: every new key present in the target environment before deploy.",
    "Secrets: every new secret provisioned in the target environment's secret store.",
    "Deployment prerequisites: infrastructure, permissions, capacity, and dependent services.",
    "Deployment order across components where one depends on another.",
    "Rollback plan exists, is specific, and accounts for anything the release makes irreversible.",
    "No unresolved critical or high findings from any reviewer role.",
    "Observability: the release's new failure modes are visible; alerts exist for what would page.",
    "Documentation and runbook impact addressed.",
    "Environment-specific risk stated: traffic, data volume, tenant exposure, and time of day.",
    "A stated way to verify success after deploy, beyond the absence of errors."
  ],
  "output_contract": {
    "status_values": ["PASS", "PASS_WITH_WARNINGS", "BLOCK"],
    "finding_severities": ["critical", "high", "medium", "low"],
    "required_fields": ["status", "findings_by_severity", "target_environment", "irreversible_steps", "rollback_plan_assessment", "post_deploy_verification"],
    "finding_fields": ["severity", "area", "problem", "risk", "required_action"],
    "notes": [
      "Passing tests are not evidence of production readiness. State what was verified and what was not."
    ]
  },
  "failure_conditions": [
    "Declaring readiness on the basis of tests alone.",
    "Assuming configuration or secrets exist in the target environment without checking.",
    "Reporting a rollback plan that has never been exercised as verified."
  ],
  "stop_conditions": [
    "Any unresolved critical or high finding: BLOCK.",
    "A required validation did not run or failed: BLOCK.",
    "An irreversible step has no rollback or recovery path and no explicit human authorization: BLOCK.",
    "All required checks completed and readiness recorded."
  ],
  "escalation_conditions": [
    "Any production deployment.",
    "Any irreversible migration or data operation.",
    "A release with an accepted known risk.",
    "A release requiring a manual step outside the automated procedure."
  ]
}
